35,東京都,府中市,30〜39歳,女性,0,0,0,0,0,0,0,,,所得制限全般についてです。児童手当もそうですし、昨年末の未来応援給付も1割の子供は日本には不要、と政府に言われたような気がしました。政府側も｢未来を応援｣などと言いながら切り捨ては｢分断には当たらない｣とばっさり。私たちの子はいらない子ですか？｢困窮支援｣と｢子育て支援｣｢子供への支援｣をごちゃ混ぜにしないでください。成長する、学ぶのにある一定以上のお金がかかるのはどの子も同じです。このご時世、タブレットやPC、通信環境を整えたり出費がかさみます。どうか子供たちを無視しないでください。現金給付が問題なら、給食、制服、学用品の補助にしてください。,
36,東京都,板橋区,40〜49歳,女性,3,0,0,1,2,0,0,,小学生 中学生 ,所得制限,"5人目1歳

子供5人の所得制限世帯。
これだけ子供がいても自助です。
ありえません。"
37,神奈川県,川崎市,30〜39歳,女性,1,0,0,1,0,0,0,,小学生 ,"所得制限です、いつまでこんな理不尽で我が子が差別される制度に付き合わないといけないのですか？？
我が子は他の子が無料で受ける医療を有料でしか受けられず、認可保育園に通えば満額の費用を求められてきました。長女は今年小学生ですが、祖父母は特に裕福でもなく、なんなら親が時々お金を送っているような状況で新品のランドセルは、低予算の中から選んでいました。
とても喜んでいましたが、他所の家と同じ給付金があれば、一番最初に欲しがったランドセルを買ってあげられただろうなと思うと、なぜ年間世帯で数百万納税しながら、差別を受けないといけないかと狂いそうになります。
我が子が国から未来を応援してもらえない、児童手当はカット、そしてこの先行きたい高校があっても、親の所得故に支援対象外（親は自分の親を生活保護にしないためにがんばってるのに）、行きたい大学があっても、奨学金すら親の所得のせいで借りられません。高額納税は犯罪ですか？自分の親を助けることは悪ですか？？？なぜ我が子が他のこどもが得られる支援すらないのか、もう全く理解できません。こどもが笑うたび、こんなこどもをおいつめる国を呪いそうになります。","所得制限のストレスがひどくて、鬱になりそうです、私の友人は自営業者夫と、サラリーマン妻で、世帯1800近くあります。その家は車も家賃も経費で、こどもの支援が国から満額出ています。
なぜそれを横目に、我が子はなにももらえないんだろうと、こんなくだらないことを考えるのをやめたいです。"
38,神奈川県,川崎市,30〜39歳,女性,0,0,0,0,0,0,0,,,"年少扶養控除が廃止され、子供手当になったはずだが、子供手当に所得制限が課される形となった事。我が家は子供手当が受け取れません。
その他、高校学費の無償化、奨学金にも所得制限がある事。2人目、3人目と考えたい所ですが、保育料も高く、学費も高くなっていると聞きますので、悩んでいます。
少子化対策が必要な現代で、なぜこのような改悪が起こるのでしょうか。
働き損、少子化対策皆無の日本の未来がどうきても悲観され、我が子に申し訳ない気持ちです。
安心して子供を産み、育てられる社会になって欲しいです。
子供基本法にて、差別されない、平等に教育を受ける権利があるとされたようですが、富裕層（実質の中間層）の子供は、差別により手当を受け取らず、高校学費の無償化の対象外の為私学進学を諦めなければならない、全く平等ではなく、貧困層の権利とあべこべになっています。累進課税で税を納めて、高い保育料を払い、何重にも徴収される事に働く意味を見失います。
子供に関する手当に関し、平等にして欲しいです。所得制限の撤廃をお願いいたします。",
39,東京都,,40〜49歳,女性,2,0,0,0,1,1,0,,中学生 高校生 ,"現政策では親の収入で 所得制限になる世帯の子どもたちが、子どもまんなかには入れてもらえず、虐げられています。

10万円給付どころか、対象外の手当がこんななたくさん。

子どもの人数が増えるほど、もらえない手当、自助の額が増え困窮。
それなのに国の教育ローンや大学の奨学金すら借りられない。
周りの子が高校無償化で私立を選べるのに、我が子は私立を諦めなければいけない。所得制限世帯は、いったい何のために高額納税しているのでしょうか？

子育て 障害児福祉の 所得制限 

【利用不可系】
児童手当
臨時特別給付金
高等学校等就学支援金
高等教育の修学支援新制度
奨学金申込権利
大学寮入寮条件
補装具費支給制度
特別支援教育就学奨励
特別児童扶養手当
障害児福祉手当
特別児童扶養手当
自立支援医療

【応能負担系】
高額療養費の自己負担額
乳幼児医療費
小児慢性疾病にかかる自己負担上限額
重度心身障害者（障害児）医療費助成
児童発達支援・放課後等デイサービス
難病医療費助成","日本税理士会連合会が 財務省、国税庁、総務省、中小企業庁などに提出した
「令和4年度税制改正に関する建議書」には
児童手当または 年少扶養控除復活 すべきと書かれています。
どうか 所得制限 で子どもや障害児福祉に関する手当がうけられない子の救済をお願いします！ 

https://www.nichizeiren.or.jp/nichizeiren/proposal/taxation/"
40,埼玉県,川口,40〜49歳,女性,2,0,0,2,0,0,0,,小学生 ,超氷河期世代。まず、安定した仕事に就けない。旦那はモラハラ、金銭DV。子供2人いるが、経済的な不安から離婚できない。母の私1人の収入で、今の生活や将来の安定した生活ができるかを考えると、とても出ないができない。本当に凹む。,2人目は発達に問題がある。
41,東京都,東京都渋谷区,20〜29歳,女性,0,0,0,0,0,0,0,,,"各種支援の所得制限。こんな制度じゃ子供を産めません。産めたとしても教育を受けさせてあげられません。なんで制限するのでしょうか。きちんと累進課税を支払っています。貧困支援ではなく、子育て支援というので有れば一律に支援していただきたいです。全て撤廃してください。
育児休暇の期間を3歳までの希望者制に延長改訂してください。保育料無償化は3歳以上からなのに、なぜ育休手当は1歳（最大2歳）まだなのでしょうか。2歳から3歳の一年はどうして支援がないのでしょうか？",一律の支援を整備して、子どもを産みたいと思える社会にしてほしいです。
42,茨城県,水戸市,30〜39歳,女性,0,0,0,0,0,0,0,,,"年々子育て支援が削減・所得制限がつくのが納得できません。児童手当貰えてありがたいと思ってました。しかし、年少扶養控除がなくなるかわりの手当なんですね。それも金額は控除額より遥かに低い。あろうことか、所得制限までつきました。高校無償化も高等教育無償化も所得制限があります。16歳以上の特別控除もなくなりました。妊娠出産だって全額カバーしてるわけじゃない。
そのくせ、後期高齢者支援金なんてものを生まれた瞬間から発生してるのも知りました。
この国は子どもを産み育てるという事をどの様に考えてるのでしょうか？長く続く少子化は国難なんではないですか？消費税増税は社会福祉費に使用されるのではなかったのですか？高齢者支援も大切でしょう。私たち子育て世代は見えていますか？子どもたちの姿は、子どもたちの未来は見えていますか？
ただでさえ、経済的にも社会情勢的にも苦しい中日々子どもと向き合い、模索しながら子育てしている私たちはあまりにも厳しい目を向けられ、支援の手は離れ安心して生きられるとは程遠い生活をしています。
経済格差、教育格差がこれ以上拡大しない為にも、少子化を加速させない為にも、所得制限撤廃、子育て支援の拡充を真剣に考えてください。これらは、私たち親への支援ではなく、全ての子どもたちへの支援である事をもう一度思い出してください。",
43,千葉県,千葉市,40〜49歳,女性,0,0,0,0,0,0,0,,,"子育て支援の所得制限について。
まず世帯所得ではなく、世帯主の所得で判断というところもおかしいし、世帯の人数が全く加味されていない点もおかしいと感じます。また財源に限りがあるというのも理解しますが、あるボーダーを超えたゼロになるというようにバッサリと切り捨てるのではなく、グラデーションをつけるような丁寧な制度設計に変えてもらえないかと思います。
コロナで低所得の子育て世帯への特別給付が複数回行われていますが、コロナで収入が減った家庭が対象になっているのでしょうか？コロナ前から低所得という家庭も含まれているのではないか？何か変だなと思ってしまいます。",
44,兵庫県,伊丹市,30〜39歳,女性,0,0,0,0,0,0,0,,,"子どもの支援の所得制限をやめていただきたいです。
児童手当、医療費、特別給付金など全てにおいてうちの子は支援を受けられていません。
子どもの支援は一律にしてほしいです。

もっと子どもを産み育てたかったですが、制限をかけられて難しいです。",
45,大阪府,箕面市,20〜29歳,女性,0,0,0,0,0,0,0,,,少子化なのに待機児童がいる事。待機児童ゼロといいながら待機児童がいる実態。シングルマザーが異性と同居しているだけで経済的支援があるとみなされている事(中には経済的支援を受けている方もいると思うんですが、そうでない方もいます。近年LGBTなどありますが、事実婚でもないのに子どもの保育園の通知が連名できたり、相手の就労状況や税金についても調べられて不快です。そして同居人がいるだけでひとり親から除外されること。同居人が他人の子育てると思いますか？事実婚状態にあるなら経済的支援や育児の協力を得られると思いますが、そうでない同居もあります。子どもを養子縁組しているなら事実婚とみなしてもいいと思うのですが異性の同居人がいると事実婚になるのはおかしい。自治体に訴えて保育園入園の加点、母子手当を受けるために同居人と別々に生活しようとすると以前、同居人がいたからひとり親には該当しないと言われました。)。所得制限はやめてください。子ども達はみんな平等です。所得制限のせいで偽装離婚している人達がたくさんいるのを政府は知っていますか？どうか今後の子ども達の生きる日本が住み良い日本になりますように、お願いします。,私は離婚をして2人の子をもつシングルマザーです。今は職場の友人(男性)と暮らしています。家の契約は友人にしてもらっていますが生活費は折半しています。他人と同居しているというところから母子手当はもらえず、ひとり親から外され待機児童となり働けなくなりました。なんとか夜に働き、貯金を切り崩し生計を立てています。周りからはシングルマザーで色々支援してもらえてるでしょ？いいね！と言われますがそんな事ありません。一切支援してもらっていないです。事実婚や養子縁組がなされていない同居者がいるシングルマザーの生活にも目を向けてください。一概に同居人(異性)いるから経済的支援、育児支援してもらってるなんて思わないでください。
46,東京都,世田谷区,30〜39歳,女性,1,0,0,1,0,0,0,,小学生 ,"所得制限があること。出生率が下がっている現在も保育園に子供を預けられない状況。基本的に母親が育児をすべきという風潮。
出生率を増やしたいのか、このまま人口減で良いのか、その方針すらわからない。
子育て世代への支援が的外れであるので、当事者の意見を吸い上げて政策を決めて欲しい。",
47,神奈川県,横浜市,30〜39歳,女性,1,0,0,1,0,0,0,,小学生 ,子育て支援全般の所得制限について。子ども3人欲しくて所得を頑張ってあげた結果、全ての支援がなくなり3人目を諦めなければならなくなった。子どもを産むために年収を下げたり、離婚を考えるなんておかしいと思います。本来、逆では？,
48,東京都,世田谷区,20〜29歳,女性,0,0,0,0,0,0,0,,,所得制限。夫婦共々頑張って働いて、多額の税金を納めているのに子育て支援がない。二人目ほしいけど、高騰する学費、自分たちの老後まで考えると一人で限界。自分の能力を高めて楽して稼いでるわけではないし、子どもも産んで未来の納税者を育ててるのに罰があたってる。とてもじゃないが、働く意欲もわかないし、子どもを沢山うもうとは思わない。,所得制限の撤廃を何卒お願いします。子どもには等しくお金がかかります。頑張って働いたら支援を得られない、なんて頑張らない者勝ちでは。やるせないです。
49,東京都,千代田区,40〜49歳,女性,1,0,0,1,0,0,0,,小学生 ,"文科省なのか教育委員会なのか、政治なのか、問題の根源は分からないが、公立学校の仕事のやり方、教師の価値観がアップデートされていない。
こどもの声や想いもちゃんと聞いていないと感じる。
一般の衣料品と比べて割高な制服・体操着・上履きを、地元の指定販売店でしか購入できないのをやめてほしい。医療もコロナ禍を経てオンライン診療がほぼ解禁されることになったしオンラインでも購入できるものにしてほしい。現代の親に、仕事家事育児の他に、指定のお店に買いに行くことを強制しないで。
国として社会主義みたいになんでも公費で費用負担軽減をするではなく、適切なところに投資して、元の財源を増やすような、歳出先のバランスを根本的に政治で考えた方が良い。",
50,神奈川県,川崎市,40〜49歳,女性,1,0,0,1,0,0,0,,小学生 ,"所得制限のせいで、医療費三割負担、未来応援給付金なし、児童手当半額、高校に入るのはまだ先だが、高校無償化対象外。
子育て支援と言いながら、親の所得で差別する、一円でもオーバーしたら支援受けられない、また世帯主の年収での計算のため、世帯全体で960万オーバーしても支援受けられると言う納得のいかない制度。
国がそのような基準を設けているから、自治体も国の基準に基づきと親の所得で差別。
子供を空気扱いしているのに税金だけはしっかり持っていく、親をATM扱い。
少子化推進する政治家達はお年寄りばかり、自分のことばかりで、日本の未来のことなんか考えていない。そんな政治にうんざり。",
51,東京都,練馬区,40〜49歳,男性,3,0,0,1,0,2,0,,小学生 高校生 ,所得制限が不公平すきる。仕事を頑張って子供3人育てるために借金してるのに。働かない人が手当や高校無償化など優遇されるのはおかしい。,
52,東京都,西東京市,40〜49歳,女性,1,0,0,0,1,0,0,,中学生 ,子育てに親の収入によって所得制限があること。不公平すぎる。,
53,東京都,中央区,30〜39歳,男性,0,0,0,0,0,0,0,,,"【所得制限廃止希望】
子育て支援に関する補助や制度において、親の所得で制限を設け、子供を差別することをやめてください。本当の資産家層は自身の所得を自由に調整して補助を総取りできる一方、高々年収1000万程度の会社員の中流層を資産実態も考慮しないまま一概に高所得者と位置づけ、あらゆる支援をひき剥がす方針には賛同できません。社会全体で少子化対策が必要であるにも関わらず、子育ての予算は増えず、その中で中流層の子育て家庭がしわよせを受け損を被る日本社会や政治には一切期待が持てず、信頼もできません。",
54,福岡県,福岡市,30〜39歳,女性,1,1,0,0,0,0,0,,妊娠中 ,子育て支援といいながら、所得制限をつけていること。年少控除を撤廃したこと(児童手当がもらえない両親共働き中間層は、実質独身者よりも苦しい現状になっている。これは子育て罰のようなもの)不妊治療しかり、授かりにくい現状がある中で、所得に関係なく子供を産み育てることが重要なのでは？　年金医療費には予算を割くのに、少子化対策には予算を割かない。子供が増え無い限り、年金医療費問題は解決しないのに、解決策にすら放棄しているように見える。,
55,東京都,杉並区,20〜29歳,女性,0,0,0,0,0,0,0,,,"2年後あたりに子どもを産みたいと考えている既婚女です。
保活をしないと保育園に入れないこと。
仕事をしながら働くためには女性の生活を犠牲にする前提になっていること。
子どもの教育費が高すぎるのに、補助が少なすぎること。
保育園の月額負担が大きすぎること。時短でお給料減ってるのに。

子どもの教育費を賄うため、子どもがいない今も教育費のためだけに月14万円貯金しています。そこまでしないと子どもは産めないのか？でも産むからにはと覚悟し、今の生活を少し犠牲にして貯金しています。お金の心配から、子どもを育てたいという気持ちが薄くなりつつあります。",
56,埼玉県,埼玉県所沢市,50〜59歳,男性,2,0,0,0,1,1,0,,中学生 高校生 ,児童福祉法施行規則の一部を改正する省令　(平成27年厚生労働省令第17号)による「放課後児童健全育成事業の届出」を市町村長(東京特別区長を含む)に提出した事業者に対し内閣府は、「子ども・子育て支援交付金」を交付し、市町村(東京特別区を含む)から届出事業者に対して、支給を義務化する規定を内閣府及び厚生労働省は制度化してほしい。,
57,大阪府,大阪市,40〜49歳,女性,0,0,0,0,0,0,0,,,"色々なものに所得制限をかけるのは理解できますが、閾値が低すぎます。都心部では世帯年収1000万円は決して裕福ではないですし、世帯年収2000万でも富裕層ではないです。それなのに高校の無償化も対象外、奨学金も取れないのに、児童手当も外されることに納得がいきません。
また児童手当の特例給付が「世帯主年収」というのも時代錯誤甚だしいです。夫1200万、妻専業主婦の世帯年収1200万の世帯では取り消されて、夫1100万、妻1100万の世帯年収2200万の世帯は取り消されないというのは制度に瑕疵があるとしか思えません。",
58,東京都,足立区,40〜49歳,女性,1,1,0,0,0,0,0,,妊娠中 ,所得制限がいろんな制度であること。フランスなどのように全ての教育や保育を無料にしてほしい。でないと、何人も子どもを育てることができない。子育てにお金がかかり過ぎる。,
59,東京都,中野区,20〜29歳,女性,1,1,0,0,0,0,0,,妊娠中 ,保育園に入れないと働けないのに働かないと入らない現状、システム。,岸田さん含め日本や国民、未来に興味のないお爺さん議員が1日でも早く辞職することを願っています。妊娠中、不快なニュースが多くこたえました。
60,神奈川県,横浜,40〜49歳,女性,1,0,0,1,0,0,0,,小学生 ,同じ子育てなのに住んでいる地域によって受けられる子育て支援にかなり差があるのはおかしいと思います。また、ありとあらゆる支援制度に所得制限があるのもおかしいと思います。社会的養護を必要とする子供でもそうでない子どもでも将来この国を背負っていくことに違いはないはずなのに一律な支援が受けられず、子供が成人するまでの20年間ずっと自助で子育てをしないといけないのは経済的にもかなり負担がかかります。保護者がどういう状況にあっても子どもが医療と教育を受ける権利は等しく保障されるべきだと思います。そうでないと安心して子育てができないし、子どもをもう一人生もうとも思えません。,
61,東京都,豊島区,30〜39歳,女性,0,0,0,0,0,0,0,,,"所得制限。子供の教育、子育てになぜ所得制限を設けるのか？所得制限世帯は思っている以上に隠れ困窮世帯です。ユニクロの服でさえ買えないぐらいです。
子供も二人目諦めました。

日本の少子化加速の原因にもなるし、あらゆる所得制限は働く意欲がなくなります。
離婚も増えると思いますけど。

年収が高い組は生活保護者や生活困窮者のために頑張って働いているわけじゃない。

子供への投資は平等に
未来の日本を作る子供への投資は平等に
子供を差別しないでください。

日本の子供は国の宝です。

教育、子育て、学生に
お金をしぶる国は潰れます。",所得制限により二人目を諦めました。離婚も考えています。
62,東京都,練馬区,30〜39歳,女性,0,0,0,0,0,0,0,,,"スーパーで売っているもので添加物が多く入っているものが多すぎます。シンプルでいいのですが、企業が売りたいがために添加物を色々入れては、消費者は添加物を避けて選び抜いて購入してる人もいるので売れ残る。そうすると小売りは売れ残ったものを安く販売する。なんだか悪循環に感じています。良いものはお金を払ってでも買いますが、身体によくないものを安いからって買ってガンになったりする、病院通いが増える、、、まさか、政治家はそうなるように考えているのか??(コロナのワクチン接種もそうですよね)
と、考えすぎてしまいます。今一度、SDGSも推奨しているので見直しが必要ではないでしょうか。

スーパーで購入するものを選ぶのに動力と時間がかかりすぎて疲れています。","練馬区は近くに直売所もありのどかです。直売所の農薬問題も心配ではありますが、新鮮なものをいただけるのは感謝しかありません。
自然を大切に、共存していきたいです。"
