140,奈良県,大和郡山市,20〜29歳,女性,0,0,0,0,0,0,0,,,田舎なので保育園に子供を入れることができたのですが、仕事がないです…車社会のなか免許ももってないので行けるところもかぎられていますが、びっくりするほどないです、その上コロナで慣らし保育も進まずこのままではせっかく入園できたのに慣らし保育が終わって仕事の面接を取り付ける前に退園になってしまいます。手にしょくがなかったり、社会人経験がなくても仕事ができる世の中にしてほしいです。,仕事がないというのは、子育て世代の今から仕事を始める人に向けての仕事がないということです。産休が取れる人はいいと思いますがつわりが酷かったり、労働環境、ストレス等で辞めざるを得ない人たちは　子供が保育園に入れたから喜べるわけではなく、子供が保育園に入って1.２年はすぐ呼び出しされるのをわかっているのに仕事を探さないといけない、しないといけない。土日やってない保育園だってあるのに平日のみ、子供の行事休ませてください、お迎えの時間があるのでこの時間までには、もしかしたら子供の呼び出しがあるかもしれません…と仕事場に伝えて仕事が出来るところなんてわずかです。テレワークなんて大企業の一部しかやってないとおもいます、時給も安い経験にもならない保育料を払えば消えてしまうお給料をもらって…何が言いたいかといいますと田舎なので仕事がない
141,東京都,江東区,30〜39歳,女性,0,0,0,0,0,0,0,,,"不平等な子育て世帯の所得制限を撤廃すべき。
子どもを親の所得で差別せずに平等に扱って欲しい。でなければ年少扶養控除を早く復活させるべき。子どもの費用は子育て世帯に負担させるなら、高齢者にかかる費用は全て高齢者間で賄ってもらわないと筋が通らない。子育て世帯に所得制限かけるなら、資産のある高齢者には年金等出さない制限をして下さい。何故そうせず、働き、子育てをし経済を回す人達を冷遇するのか。中途半端なクーポン等のばら撒きより長期の安定した支援をすべき。",
142,群馬県,,30〜39歳,女性,1,0,0,1,0,0,0,,小学生 ,大学費用準備の負担が大きい。長時間労働が当たり前の社会では、子育てとの両立に負荷が大きい。子どもとの時間を優先して非正規で働けば給与が足りず、正社員では長時間労働を強要され子どもとの時間が取れない。子育てのために時短希望や残業不可では正社員に採用されにくく、長時間労働できることが社会人としての価値のようで、自身がなんのために大学を出たのかとむなしくなる。,
143,埼玉県,,30〜39歳,女性,1,1,0,0,0,0,0,,妊娠中 ,"コロナ禍における子どものマスクの運用を見直してほしいです。厚労省はあくまで任意と言っているものの、実質は運動の時間も含めて強制になっています。マスクではコロナの感染は防げないことが今までの2年間で明らかになったにも関わらず（国立感染研もエアロゾルが主と認めましたよね？）厚労省のはその部分は全くアップロードせず、「マスクをしてください」のアナウンスばかり。子どもにとっては慢性的な酸素不足やコミュニケーション能力の低下、学力低下など、海外でデメリットが多いとの研究結果が出ているにも関わらず何も変わりません。
ここまで子どもにコロナの責任を押し付ける国があるでしょうか？
いい加減、子どもたちにマスクを強要することは辞めるよう政治家がアナウンスしてください。そうしないと教育委員会や保育園は子どもたちにマスクをさせることをやめさせる決断ができないのです。",選挙前に2類から5類へ変更し、子どもたちのマスク撤廃のアナウンスをしないのであれば、自民党に票を入れることはないです。
144,宮城県,仙台市,30〜39歳,女性,0,0,0,0,0,0,0,,,守られるべき子ども達が、コロナ禍で1番犠牲になり、子どもらしく生きる権利を奪われ続けていることが、もう耐えられない。苦しいのにマスク強制、子ども達の相互監視社会、食べる楽しみを放棄したアクリル板に囲まれての15分以内黙食。突然の休校に行事の中止。部活動など努力してきたことを大人の都合で奪われる。こんな環境で子ども達は伸びやかに育つのか？諸外国は子ども中心の考えの元、子ども達への制限は最低限であり最終手段だった。対して日本は子ども達を感染源呼ばわりし、3年経った今、更に規制を強める。非科学的で非人道的。票にも金にもならない子ども達はどうでもいいのか？！日本の子ども達こそ、国の未来じゃないのか？,
145,東京都,中央区,30〜39歳,女性,0,0,0,0,0,0,0,,,子育て世帯への支援で所得制限がつけられているのと,
146,大阪府,,30〜39歳,女性,2,0,0,2,0,0,0,,小学生 ,"子育て支援の所得制限はおかしいです。
累進課税にて収入に対する税金は納めています。
児童手当や高校授業料無償化などの制度に所得制限をかけるなら累進課税をやめるか、年少扶養控除を復活させないと不当に徴税していることになりませんか？",
147,兵庫県,神戸市,20〜29歳,女性,0,0,0,0,0,0,0,,,"年少扶養控除がないこと。
児童手当が親の所得により額が異なる、またなくなること。
高校無償化の所得制限があること。
こどもの医療費が自治体により所得制限を設けていること。
障害児支援にまで所得制限があること。
所得制限は出産制限です。所得制限がなくなるなら2人、3人子供が欲しかった。",
148,宮城県,仙台市,40〜49歳,女性,2,0,0,1,0,1,0,,小学生 高校生 ,"幼稚園や学校の過剰な感染症対策の見直しをして欲しい。(マスクや黙食など) 
子供の医療費や私立高校支援等の所得制限の撤廃をしてほしい。",
149,東京都,江東区,40〜49歳,女性,3,0,0,1,1,1,0,,小学生 中学生 高校生 ,年少扶養控除がなく所得制限により児童手当や高校無償化の恩恵を受けられないことは、子どもの人権侵害である,少子化は国難であるにもかかわらず国が少子化を促進し勤労意欲も下げる政策を行っていることが不思議でなりません。
150,神奈川県,藤沢市,40〜49歳,女性,0,0,0,0,0,0,0,,,消費税が高い。減税すべき。,
151,和歌山県,わかやまし,30〜39歳,女性,0,0,0,0,0,0,0,,,所得制限により、子育て支援が全く受けられない状況です,
152,東京都,文京区,30〜39歳,男性,0,0,0,0,0,0,0,,,学校無償化における所得制限も問題だが、全体として大学卒業までにお金がかかりすぎて、十分な教育環境を整えられない。過去の不妊治療(出産までした場合)の遡り助成が無いのはおかしい。駅から外にでるバリアフリールートが限定的なケースが残存している。また、エレベーターにベビーカーが乗れず元気な高齢者が我が物顔で乗っており、中には攻撃的な言動により子ども連れを排除するケースも見られる(優先すべき人について、めいっぱい大きな掲示で警告すべきだと考える)。育児休業給付金の上限が低く、物価の高い東京などでは男性の育休取得が全く現実的でない(世帯で給付額を制御すべき)。,
153,神奈川県,川崎市,30〜39歳,女性,0,0,0,0,0,0,0,,,"所得制限で子育て支援を差別するのはおかしい。扶養控除がなく、子供をいないものと扱っていることはおかしい。なぜ、独身者と一緒の扱いなの？子育てにかかる費用は半端なくかかる。
子育てを馬鹿にしているとしか思えません
直ちに扶養控除の復活と所得制限撤廃を求めます。","かなり我慢してます！これ以上子供を除け者にするな。未来を支える子供たちになんて冷たい態度なんだ。日本は。そりゃ少子化です。
少子化に、もっと真剣に向き合ってください。"
154,神奈川県,,40〜49歳,女性,1,0,0,1,0,0,0,,小学生 ,"お金バラマキやってるのに、子育て世代の支援は減らす。少子化対策本気で考えていると全然思えない。
いろいろな手当等に所得制限があるのがおかしい。所得制限は撤廃するべき。
障がい児に対する支援が全然足りない、人手が足りないからと幼稚園など入園拒否されます。
教育を受ける権利は平等であるべき。",
155,神奈川県,川崎市,30〜39歳,女性,1,0,0,1,0,0,0,,小学生 ,医療費の所得制限,児童手当無し、医療費一歳から自費、保育費用最高額希望園入れない、小学生は保育費用にカウントされない私立高校無償化は子ども四人でも無し、近隣の500万世帯がなぜか新築に高級車、習い事多数、小さい怪我で頻繁に通院何で？
156,東京都,葛飾区,30〜39歳,女性,0,0,0,0,0,0,0,,,"現在未就学の娘を抱えております。夫婦で奨学金の返済が併せて月に70,000円(トータル残高約1200万円)あり、生活に困窮しています。私もなんとかフルタイムで働いていますが、残業もできずこれ以上年収をあげられません。

高校授業料無償化や、奨学金をこれから借りる方への返済不要奨学金などの施策がありますが、今、その年齢まで育てるのが本当に厳しいんです。

これから借りる方だけでなく、現在奨学金の返済に苦しんでいる人々への返済額を減額するなどの検討をお願いしたいです。

自分たちの努力だけでは、いつまで経っても貧困から抜け出せません。
月の返済を減額し、返済期間を延ばす手段では解決に全くなりません。

せめて、奨学金を所得控除するなどしていただきたいです。
保育園費用の計算や、
高校無償化などの給与条件にも、親が奨学金を借りている場合は、その金額を所得額から引くなどの配慮をいただきたいです。

どれだけ努力してきても、元々生まれた環境により歩む人生が異なり過ぎます。政治の力で少しでも格差を是正してほしいです。

またこのような声をどこに届けたら
きちんと取り合っていただけるのかも明確にしてもらえたら嬉しいです。",よろしくお願いします。
157,岡山県,岡山市,30〜39歳,女性,2,0,0,2,0,0,0,,小学生 ,"10万円の「未来応援給付」が理不尽な「所得制限」のために全国で約200万人の子どもがもらえませんでした。夫婦共稼ぎで1800万円稼いでいても子どもに支給されるのに、１馬力で960万円稼ぐと支給されないという、先進国とは思えない理不尽な線引きで、逆転現象が生まれています。
もらえた子どもは自宅用タブレット端末やプログラミング教材、顕微鏡や望遠鏡を買うなどしていますが、もらえなかった子どもはそれもままなりません。
その後、「地方創生臨時交付金」が何億円も自治体に配られて、それを財源にして所得制限世帯にも補填して支給できるようになりましたが、補填支給している自治体は総社市や備前市など限られていて、倉敷市や岡山市などは対応していません。政治家の皆さんに動いていただきたいです。",10万円の未来応援給付が不合理な所得制限でもらえなかった子どものために、地方創生臨時交付金で補填支給してもらいたいです。
158,千葉県,千葉市,30〜39歳,男性,0,0,0,0,0,0,0,,,"主におかしいと思うところになりますが、

氏名、住所、現況等同じような内容を記入する回数の多さ。
出産育児関連のアンケートに男性の観点がないこと。
窓口の担当者が母親にしか質問していないこと。(父親がくるのが想定外？)等

セーフティネットと連携するために最低限、母親を対象にアンケートや対応を行っているのであれば、その旨を事前に通知しておかないと「時代にそぐわない」とあらぬ誤解を生むと思います。

父母教室での講義内容も精神論的な話(赤ちゃんはお母さんを選んで産まれてくる等)が混ざっており、昔からある育児雑誌と内容が変わらず、情報化社会においてあまり意味をなしていませんでした。
むしろ母親体験などは父親に母親と生物的観点からも全く同じ役割を期待するかのような、よくわからない平等化の意思すら感じ、方針に幼稚では？と夫婦共に違和感を覚えました。
出産前後の夫の仕事は母親と同じ辛さを味わうことではないはずです。

このような前時代的な価値観を排除するだけで運営もスムーズになるかと思いました。","今ならWebを活用し情報を文章や動画として配信する、SNSを整備する、など、より多くの困っている人へ時間の制約なくアプローチできる方法もあるかと思います。

全てにおいてIT化という極端な話でなく、時代にあった適切な制度設計をお願いしたいです。"
159,東京都,大田区,40〜49歳,男性,1,0,0,1,0,0,0,,小学生 ,"・所得制限の撤廃
・３人目以降の子供に、税制の優遇や児童手当増額","５人目妊娠中
１人目の中学校が選択できませんでした。"
160,山形県,,40〜49歳,女性,1,0,0,1,0,0,0,,小学生 ,この4月に小学校に入学したが、購入しなくてはいけない備品が多すぎて経済的負担が大きい。特に算数セットはおさがりではなく新しいのを購入しなくてはいけないが、1+1=2など簡単な計算カード、おはじきなどは低学年でしか使わないことは明らか。学校の備品としてあれば十分だと思う。入学時の経済的負担を減らすためにも算数セット、粘土板など学校の備品として揃えてほしい。,学校に入学するにあたって様々な備品を購入したが、どれもこれも大人目線で子どもを「管理」しやすいように、指定された同じものを使うようになっていると感じた。消しゴムの色まで指定されているのには違和感しかない。多様性とは程遠い学校文化では、子どもたちの間で異質なものを排除する土台ができてしまうのではないかと危惧している。先月まで通っていた幼稚園では子ども一人一人の個性を尊重してくれたが、１８０度違う学校カルチャーに驚いている。
161,大阪府,,30〜39歳,女性,0,0,0,0,0,0,0,,,"所得制限で子供になんの支援も得られない。
所得制限世帯厳しすぎる税金の取り方をして、なんの還元もない貧乏人に優しい国。幼保無償化に所得制限をかけたら、幼稚園自体やめなければいけないほど生活は厳しい現実。世帯収入についてしっかり把握してほしい。",
162,東京都,世田谷区,30〜39歳,女性,0,0,0,0,0,0,0,,,"子ども支援への所得制限と保活の厳しさ。
保活は周りの声から、世田谷区目黒区はほんとうに大変という認識があったので、0歳4ヶ月で保育園に入れました。もっと一緒にいたかったけれど、一番入りやすかったから。
早くに職場復帰をして、子どものために少しでもお金をと思ったら、税金でかなり持っていかれる上に、稼げば子どもの支援に制限がかかると。今後昇給を目指す気持ちが萎えました。2人目は、産むべきではないと頭では考えています。",
163,東京都,世田谷区,30〜39歳,男性,1,0,0,1,0,0,0,,小学生 ,多子世帯に対する支援が少なすぎると思います。現在4人の子どもを育てているので、現実的にはお金が必要。乳幼児はが多いのでオムツやミルクも支給してもらえるとありがたい。また、大きくなってから学費の問題も、保育料無償化と同様に、多子世帯に対する無償化を検討してもらいたいです。,
164,兵庫県,西宮市,30〜39歳,女性,1,0,0,1,0,0,0,,小学生 ,年少扶養控除の代わりの児童手当が、所得制限により減額。なんとその減額分すら0円になり、我が子は国から無いものとされている。毎日激務の中必死で働いた中から搾り取られ、子育て支援一切なし、自助でやれと…この国で更に子供産みたいと思えません。16歳から扶養控除がありますが、早生まれの子は制度から抜け落ち1年間控除を受けれません。この制度はおかしい、早生まれの子も平等に学年で区切って制度に入れてください。,所得制限反対。年少扶養控除復活。
165,千葉県,我孫子,30〜39歳,女性,0,0,0,0,0,0,0,,,年少扶養控除を復活させてください。お金がないです。二人目もつくりたいので所得制限も撤廃してほしいです。,
166,神奈川県,横浜市,40〜49歳,女性,2,0,0,1,1,0,0,,小学生 中学生 ,所得制限,
167,神奈川県,横浜市,40〜49歳,女性,2,0,0,2,0,0,0,,小学生 ,"子供に関する手当や助成等の支援に所得制限をつけるのはおかしいです。
累進課税に加えて手当もなしでは、まるで二重課税です。
児童手当も医療費助成も障害児の就学奨励金も療育を受ける費用も、少し所得が高いというだけで手当ゼロだったり負担額が大きかったり。
昨年末の十万円の特別手当支給時も対象外でしたが、ニュースを見た子供が「うちももらえるの？」と聞いてきて答えづらかったです。
子供に関する支援は全員平等にしてほしいです。",
168,愛知県,名古屋市,40〜49歳,女性,2,0,0,1,1,0,0,,小学生 中学生 ,"第一子中2が不登校です。理由は色々あるのですが、一番は「制服を着たくない」が理由です。
頑固な子ですが、制服を着る意義、納得のいく理由があるなら、決まりを守る子です。ですが、納得のいく理由を学校側から説明されたことはありません。
親側も、制服の着用義務には懐疑的で、体操服の活用や私服の許可を打診しましたが、受け入れられませんでした。
ズボンタイプは試作品はあるものの、運用時期については未定とのこと。期待しないでほしい、と言われました。
制服に見えない改造を施すことは学校に相談の上で可能とのことですが、そこまでして制服を着用して中学校に通う意義が見いだせず、話は止まったままです。
カウンセリングのために私服で来校した時は、他の生徒の目に触れないこと、と条件を出され、そんなに制服でないことは悪いことなのかと、モヤモヤした気持ちになりました。
親としては、中学校は義務教育なのに、制服でなければ授業を受けることができない状況を疑問に思います。",
169,東京都,目黒区,30〜39歳,女性,2,0,0,2,0,0,0,,小学生 ,学校、教育制度すべて！,"とにかく、学校の詰め込み教育が時代にそぐわない感満載で嫌になります。
決められたやり方、みんなと一緒の謎ルールに縛られて身動きが取れない状態。
これじゃあ、才能がある子も伸びないし芽を摘んでしまっています。

思い切って教育改革をして欲しいです。
未来を担う子ども達のために。"
170,東京都,練馬区,40〜49歳,女性,3,0,0,1,1,1,0,,小学生 中学生 高校生 ,"年少者扶養控除がこども手当のためになくなり、児童手当に変わって給付金額も減ったのに控除廃止はそのままて、今回も所得制限で受給できなくなりそうです。
多子世帯で所得制限対象世帯は児童手当てより年少者扶養控除があった方が良いです。
一生懸命ワンオペ子育てしてるのに。世帯主は一生懸命仕事してるのに。
所得制限がかかる世帯で子供の数が増えません。子供の教育に熱心な世帯の子供が増えません。少子化対策になってません。この国は子供を増やす気がないんだと思いました。この春娘が公立中学に入学しました。入学に必要な制服代、用品など、ざっと10万近くかかるのに、臨時未来給付金の所得制限の対象世帯のため、給付は受けられなかった。将来のある子どもたちに支援をするなら
そこは親の所得抜きに平等に給付するべきだと思います。
また、子どもの医療費の公的給付も所得制限があり、病気になるならないは親の収入は関係ないと思います。",不満に感じていても所得制限対象者は少数派だから声を上げれず、グッと我慢していました。今回、初めて意見を書けて泣きそうです。
171,埼玉県,,30〜39歳,女性,0,0,0,0,0,0,0,,,"子どもに扶養控除がないこと！
その代わりの児童手当には所得制限があり、満額もらえない。満額もらっても扶養控除（38万）に比べて少なすぎる。何でもかんでも所得制限で対象から外される。何故、「所得」だけで判断？",子育て世帯に所得制限で再分配が必要なら、老人にも「資産」制限で年金・医療費・介護費の見直しが必要なのでは？
172,千葉県,,30〜39歳,男性,1,1,0,0,0,0,0,,妊娠中 ,所得制限　子育て　高校までの無償化　医療の無償化,
173,兵庫県,西宮市,40〜49歳,男性,2,0,0,1,0,1,0,,小学生 高校生 ,"・サラリーマンだと共働きでもしないと、私立学校に行かすことも躊躇する。頑張っても頑張っても所得制限で恩恵を受けず、給料が上がっても、可処分所得は下がる一方。
・義務教育のあり方。塾ありきの教育のあり方に疑問。校区による格差に疑問。その結果進学に影響。これでいいのか日本の教育。",
174,埼玉県,さいたま市,30〜39歳,女性,1,0,0,1,0,0,0,,小学生 ,"保育料が所得によって違い、決して裕福ではない世帯も高い保育料を支払わなくてはいけないのに、子供手当もゼロになってしまっておかしい。　中間層が搾取されている。配偶者控除が2000万以上の所得をボーダーとしているように子供手当も2000万以上をボーダーとするべき。
年金には所得制限がないのに、子供に関する補助は全て所得制限があるのはおかしい。不公平だと思う。",子供手当所得制限反対、保育無償化の所得制限を設けることに反対です。
175,静岡県,浜松市,40〜49歳,女性,4,0,0,0,2,2,0,,中学生 高校生 ,"所得制限。年少扶養控除廃止された上での、所得制限。
児童手当、給付金、高校無償化、奨学金、ありとあらゆる子育て支援の全てに対象外です。
特に高校無償化は、子どもの人数を考慮していない制度です。
少子化対策と言いながら、多子家庭を苦しめる事しか政府はしません。
どうしても所得制限したいなら、年少扶養控除、高校生の扶養控除を大人と同額に。
扶養控除を復活させたくないなら、所得制限廃止に。",
176,東京都,中野区,30〜39歳,女性,0,0,0,0,0,0,0,,,こどもに関する補助の所得制限をなくしてほしい。こどもは大人の所有物ではなく独立した存在で、親の所得により受けられる補助が違うのはおかしい。また、リソースや兄弟の数によって家庭の経済状況も違い、所得だけで一概に「余裕あり」と判断できないと思う。,
